{"contract_version":"1.2","task_id":"detect","status":"completed","findings":[{"locator":"gdrive:fileid0001","rule_id":"example","rule_class":"credential","masked_snippet":"key=********[24]","location":"[REDACTED]","confidence":0.9,"external_fingerprint":"abcdefabcdefabcdefabcdefabcdefabcdefabcdefabcdefabcdefabcdefabcd"}],"complete_locators":["gdrive:fileid0001"]}