{"contract_version":"1.2","task_id":"detect-exposures","status":"completed","findings":[{"locator":"gdrive:fileid0001","rule_id":"example","rule_class":"credential","masked_snippet":"key=********[24]","location":"[REDACTED]","confidence":0.9,"external_fingerprint":"abcdefabcdefabcdefabcdefabcdefabcdefabcdefabcdefabcdefabcdefabcd"}],"resource_exposures":[{"locator":"gdrive:fileid0001","visibility":"private","external_principal_count":0,"shared_drive":false}],"complete_locators":["gdrive:fileid0001"]}