{"contract_version":"1.2","task_id":"scan-shard","status":"completed","findings":[{"locator":"gdrive:fileid0001","rule_id":"example","rule_class":"credential","masked_snippet":"key=********[24]","location":"[REDACTED]","confidence":0.9,"external_fingerprint":"abcdefabcdefabcdefabcdefabcdefabcdefabcdefabcdefabcdefabcdefabcd"}],"resource_exposures":[{"locator":"gdrive:fileid0001","visibility":"private","external_principal_count":0,"shared_drive":false}],"resource_inventories":[{"locator":"gdrive:fileid0001","kind":"table","item_count":2},{"locator":"gdrive:fileid0002","kind":"file"}],"stats":{"resources_scanned":2,"resources_failed":1,"bytes_scanned":100},"complete_locators":["gdrive:fileid0001","gdrive:fileid0002"]}